<?xml version="1.0" encoding="UTF-8"?>
<MessageHeaderEnrichRules xmlns:xsi="http://www.w3.org/2001/XMLSchema-instance" xsi:noNamespaceSchemaLocation="../Config/MessageHeaderEnrichRule.xsd">
<!--   <MessageHeaderEnrichRule> -->
<!--     <MessageHeaderEnrichRuleIdentifier> -->
<!--       <MessageHeaderEnrichRuleIdentifierKeyValue> -->
<!--         <MessageHeaderEnrichRuleIdentifierKey>jms/jmsdestination</MessageHeaderEnrichRuleIdentifierKey> -->
<!--         <MessageHeaderEnrichRuleIdentifierValue>TrainEventQ</MessageHeaderEnrichRuleIdentifierValue> -->
<!--       </MessageHeaderEnrichRuleIdentifierKeyValue> -->
<!--       <MessageHeaderEnrichRuleIdentifierKeyValue> -->
<!--         <MessageHeaderEnrichRuleIdentifierKey>jms/jmstype</MessageHeaderEnrichRuleIdentifierKey> -->
<!--         <MessageHeaderEnrichRuleIdentifierValue>TrainEventSpecial</MessageHeaderEnrichRuleIdentifierValue> -->
<!--       </MessageHeaderEnrichRuleIdentifierKeyValue> -->
<!--     </MessageHeaderEnrichRuleIdentifier> -->
<!--     <MessageHeaderEnrichValues> -->
<!--       <MessageHeaderEnrichValueKeyValue> -->
<!--         <MessageHeaderEnrichValueKey>MessageID</MessageHeaderEnrichValueKey> -->
<!--         <MessageHeaderEnrichValue>MessageHeaderEnrichValue</MessageHeaderEnrichValue> -->
<!--       </MessageHeaderEnrichValueKeyValue> -->
<!--       <MessageHeaderEnrichValueKeyValue> -->
<!--         <MessageHeaderEnrichValueKey>MessageType</MessageHeaderEnrichValueKey> -->
<!--         <MessageHeaderEnrichValue>MessageHeaderEnrichValue</MessageHeaderEnrichValue> -->
<!--       </MessageHeaderEnrichValueKeyValue> -->
<!--       <MessageHeaderEnrichValueKeyValue> -->
<!--         <MessageHeaderEnrichValueKey>SourceApplication</MessageHeaderEnrichValueKey> -->
<!--         <MessageHeaderEnrichValue>MessageHeaderEnrichValue</MessageHeaderEnrichValue> -->
<!--       </MessageHeaderEnrichValueKeyValue> -->
<!--       <MessageHeaderEnrichValueKeyValue> -->
<!--         <MessageHeaderEnrichValueKey>CorrelationID</MessageHeaderEnrichValueKey> -->
<!--         <MessageHeaderEnrichValue>MessageHeaderEnrichValue</MessageHeaderEnrichValue> -->
<!--       </MessageHeaderEnrichValueKeyValue> -->
<!--       <MessageHeaderEnrichValueKeyValue> -->
<!--         <MessageHeaderEnrichValueKey>TimeStamp</MessageHeaderEnrichValueKey> -->
<!--         <MessageHeaderEnrichValue>MessageHeaderEnrichValue</MessageHeaderEnrichValue> -->
<!--       </MessageHeaderEnrichValueKeyValue> -->
<!--       <MessageHeaderEnrichValueKeyValue> -->
<!--         <MessageHeaderEnrichValueKey>Operation</MessageHeaderEnrichValueKey> -->
<!--         <MessageHeaderEnrichValue>MessageHeaderEnrichValue</MessageHeaderEnrichValue> -->
<!--       </MessageHeaderEnrichValueKeyValue> -->
<!--     </MessageHeaderEnrichValues> -->
<!--   </MessageHeaderEnrichRule> -->
  <MessageHeaderEnrichRule>
    <MessageHeaderEnrichRuleIdentifier>
      <MessageHeaderEnrichRuleIdentifierKeyValue>
        <MessageHeaderEnrichRuleIdentifierKey>abc</MessageHeaderEnrichRuleIdentifierKey>
        <MessageHeaderEnrichRuleIdentifierValue>123</MessageHeaderEnrichRuleIdentifierValue>
      </MessageHeaderEnrichRuleIdentifierKeyValue>
   </MessageHeaderEnrichRuleIdentifier>
    <MessageHeaderEnrichValues>
      <MessageHeaderEnrichValueKeyValue>
        <MessageHeaderEnrichValueKey>MessageID</MessageHeaderEnrichValueKey>
        <MessageHeaderEnrichValue>jms/jmsmessageid</MessageHeaderEnrichValue>
      </MessageHeaderEnrichValueKeyValue>
      <MessageHeaderEnrichValueKeyValue>
        <MessageHeaderEnrichValueKey>MessageType</MessageHeaderEnrichValueKey>
        <MessageHeaderEnrichValue>"TrainEvent"</MessageHeaderEnrichValue>
      </MessageHeaderEnrichValueKeyValue>
      <MessageHeaderEnrichValueKeyValue>
        <MessageHeaderEnrichValueKey>SourceApplication</MessageHeaderEnrichValueKey>
        <MessageHeaderEnrichValue>"MainFrame"</MessageHeaderEnrichValue>
      </MessageHeaderEnrichValueKeyValue>
      <MessageHeaderEnrichValueKeyValue>
        <MessageHeaderEnrichValueKey>CorrelationID</MessageHeaderEnrichValueKey>
        <MessageHeaderEnrichValue>jms/breadcrumbid</MessageHeaderEnrichValue>
      </MessageHeaderEnrichValueKeyValue>
      <MessageHeaderEnrichValueKeyValue>
        <MessageHeaderEnrichValueKey>TimeStamp</MessageHeaderEnrichValueKey>
        <MessageHeaderEnrichValue>SystemTime</MessageHeaderEnrichValue>
      </MessageHeaderEnrichValueKeyValue>
      <MessageHeaderEnrichValueKeyValue>
        <MessageHeaderEnrichValueKey>Operation</MessageHeaderEnrichValueKey>
        <MessageHeaderEnrichValue>"NewTrainEvent"</MessageHeaderEnrichValue>
      </MessageHeaderEnrichValueKeyValue>
     </MessageHeaderEnrichValues>
  </MessageHeaderEnrichRule>
</MessageHeaderEnrichRules>
